{
  "schemaVersion": 1,
  "sequenceId": "Sequence.Npc.TusiChief.Default",
  "sequenceVersion": 1,
  "stageContractId": "Stage.Town.NpcInteraction",
  "entryStep": "dialogue",
  "roles": {"Npc": "Npc.TusiChief"},
  "steps": {
    "dialogue": {
      "type": "dialogue",
      "dialogueId": "Dialogue.Npc.TusiChief.Default",
      "next": "branch"
    },
    "branch": {
      "type": "branchOnOutcome",
      "outcomes": {
        "Outcome.Task": "task",
        "Outcome.Leave": "end"
      }
    },
    "task": {
      "type": "command",
      "commandId": "open_task_offer",
      "commandType": "openTaskOffer",
      "next": "end"
    },
    "end": {"type": "end"}
  }
}
